Ketua DPP Golkar Tolak Sistem Coblos Partai: Bikin Lupa Turba ke Rakyat, 22 Feb 2023 19:12 ,https://news.detik.com/pemilu/d-6583540/ketua-dpp-golkar-tolak-sistem-coblos-partai-bikin-lupa-turba-ke-rakyat,"Ketua DPP Golkar Dave Laksono menegaskan pihaknya menolak sistem proporsional tertutup atau coblos logo partai, bukan nama calegnya langsung, diberlakukan di Pemilu 2024. Dave menilai sistem pemilu tertutup dapat membuat para calon legislatif (caleg) melupakan turun ke bawah (turba) mengurusi rakyat.""Yang kita ingin kejar itu adalah masyarakat tetap memiliki hak untuk memilih, masyarakat tetap memiliki hak untuk menyampaikan pendapatnya, dan juga dengan mendorong menjadi sistem proporsional tertutup itu bisa dilupakan turun ke bawah, reses-reses, pasti anggota-anggota (DPR), 'Ya udah ngapain capek-capek. Nunggu di ujung aja, toh kan nanti nomor urut',"" kata Dave kepada wartawan di kompleks parlemen, Senayan, Jakarta, Rabu (22/2/2023).Dave berpandangan, pemberlakuan sistem proporsional tertutup bakal memberangus fungsi aspirasi anggota DPR. Sebabnya, menurut dia, sistem ini bakal membuat para caleg cukup bergantung pada keputusan partai, sehingga meminggirkan kewajibannya untuk turun ke rakyat.                ""Kalau misalnya kita itu sudah tidak lagi mencoblos nama, kembali ke proporsional tertutup, ya fungsi aspirasinya itu sudah otomatis akan berkurang bahkan hilang. Ya kita ngapain capek-capek turun ke bawah. Tinggal tunggu partai yang nentuin,"" ujar anggota Komisi I DPR ini.Lebih lanjut, Dave menilai sistem ini membuat partai hanya bertumpu pada segelintir figur saja. Dia menegaskan hal ini harus dihindari.""Jadi akhirnya partai yang harus bekerja, partai yang harus turun, akhirnya partai apa, akan bertumpu kepada satu dua figur. Partai kan pasti akhirnya bertumpu kepada dua, tiga figur. Siapa yang, apa namanya, ketua umum ataupun juga siapapun figur yang partai jual akhirnya semua berlari ke sana, tidak lagi berlari kepada anggota parlemen,"" kata Dave.""Jadi kotaknya masyarakat itu akan semakin lama semakin hilang, semakin berkurang. Jadi itu yang harus kita patahkan, itu harus kita putus,"" imbuhnya.Untuk diketahui, sistem pemilu saat ini yang memberlakukan sistem proporsional terbuka atau coblos nama caleg langsung, bukan logo partai, sedang menjadi perkara gugatan di Mahkamah Konstitusi (MK). Ada enam pemohon yang tertulis dalam gugatan UU Pemilu di MK tersebut. Mereka ialah:1. Demas Brian Wicaksono (pengurus PDIP Cabang Probolinggo)2. Yuwono Pintadi3. Fahrurrozi (bacaleg 2024)4. Ibnu Rachman Jaya (warga Jagakarsa, Jaksel)5. Riyanto (warga Pekalongan)6. Nono Marijono (warga Depok)Dalam gugatannya, pemohon meminta MK mengabulkan permohonan agar sistem pemilu diubah menjadi proporsional tertutup atau coblos gambar partai bukan nama caleg.Simak juga Video 'Golkar Jatim Dorong Khofifah Bisa Jadi Cawapres Airlangga': [Gambas:Video 20detik]"
"Bupati Kendal Dico Temui Gibran di Solo, Kaget soal Survei Pilgub Jateng", 22 Feb 2023 18:06 ,https://news.detik.com/pemilu/d-6583398/bupati-kendal-dico-temui-gibran-di-solo-kaget-soal-survei-pilgub-jateng,"Bupati Kendal Dico Ganinduto bertemu dengan Wali Kota Solo Gibran Rakabuming Raka di rumah dinas Loji Gandrung. Dico mengaku sempat bicara politik dengan Gibran Rakabuming.Seperti dilansir detikJateng, salah satu yang sempat keduanya bicarakan yakni mengenai hasil survei di Pilgub Jateng. Dico mengaku sempat kaget dengan adanya survei Pilgub Jateng 2024 versi lembaga Survei Aksara Research and Consulting.""Iya tadi sempat ngobrolin juga masalah survei, jadi sama-sama kaget kita juga nggak tahu. Jadi tadi sama-sama nanya 'Mas survei itu gimana sih?' Jadi sama-sama kaget juga,"" kata Dico di Loji Gandrung, Rabu (22/2/2023).                Dico pun menyampaikan terima kasih soal restu yang diberikan Sekretaris DPD I Golkar Jateng Juliyatmono. Namun, suami Chacha Frederica ini mengaku masih fokus dengan tugasnya Bupati Kendal.Dia juga menjawab saat disinggung soal duet bareng Gibran di Pilgub Jateng. Dico mengaku saat ini fokus pada Pilpres dan Pileg terlebih dahulu.""(Duet Gibran Dico) Masih panjang prosesnya. Mas Gibran dari PDI, saya dari Golkar nanti ketum seperti apa. Sekarang fokusnya masih Pilpres dan Pileg dulu. Saya rasa di partai Mas Gibran dan saya sama, baru fokus Pilpres dan Pileg baru nanti pilkada,"" pungkasnya.Baca berita lengkapnya di sini.Lihat juga Video 'Gerindra Siap Dukung Gibran Rakabuming di Pilgub 2024': [Gambas:Video 20detik]"
"Projo Beri Selamat JoMan Dukung Prabowo di Pilpres 2024, Bakal Nyusul?", 22 Feb 2023 17:20 ,https://news.detik.com/pemilu/d-6583288/projo-beri-selamat-joman-dukung-prabowo-di-pilpres-2024-bakal-nyusul,"Rombongan relawan Jokowi Mania (JoMan) telah resmi mendukung Prabowo Subianto di Pilpres 2024, setelah sebelumnya menyatakan dukungan ke Ganjar Pranowo. Relawan Pro Jokowi (Projo) memberikan selamat atas sikap yang diambil JoMan.""Pertama, saya ucapkan selamat dulu buat Noel yang sudah mengambil sikap. Apapun itu harus kita hargai dalam konteks demokrasi,"" kata kata Ketua Panitia Musra Projo, Panel Barus di FX Senayan, Jakarta Pusat, Rabu (22/2/2023).Menurut dia, keputusan Noel untuk mengubah dukungannya merupakan hal wajar. Dia menyebut setiap orang memiliki hak untuk memilih calon dukungannya.                ""Saya pikir itu pilihan, sama kayak teman-teman mau beli sesuatu pilih-pilih, tiba-tiba gak cocok akhirnya beli yang lain, itu biasa saja. Itu hak setiap orang, setiap organisasi mau dukung siapa. Saya ucapkan selamat kepada Noel sudah mengambil sikap seperti itu,"" ujarnya.Lebih lanjut, Panel mengaku menghargai keputusan Noel JoMan untuk mendukung Prabowo. Dia menyebut untuk Projo akan menentukan dukungan secara bertahap.""Gini, kaitannya dengan Noel dukung Jokowi kan dia punya organisasi namanya JoMan. Kalau hari ini dia bikin apa mania pun itu kan dalam konteks 2024, saya memahaminya begitu. Sama halnya organisasi relawan yang ada di musra, ada Projo, misalnya. Ada yang lain-lain lah, pasti di 2024 menentukan sikapnya, kan begitu,"" kata dia.""Cuma bedanya kami melakukan tahap yang namanya musra dulu, sesuai arahan Pak Jokowi untuk menggali kembali aspirasi, kehendak rakyat,"" sambung Panel.Untuk diketahui, Relawan JoMan menyatakan mendukung Prabowo untuk maju sebagai capres di Pemilu 2024. Dukungan ini dinyatakan beberapa saat setelah Relawan JoMan membubarkan Ganjar Pranowo (GP) Mania.""DPP Jokowi Mania (JoMan) memutuskan untuk mendukung Prabowo Subianto sebagai calon presiden 2024/2029,"" kata Sekjen Relawan JoMan Akhmad Gojali dalam konferensi pers di DPP JoMan, Jakarta Selatan, Rabu (15/2).Selain relawan JoMan, Abu Janda yang dikenal sebagai salah satu pendukung Presiden Jokowi juga menyatakan mendukung Prabowo Subianto sebagai calon presiden 2024.Simak juga Video: JoMan, GP Mania, Kini Prabowo Mania[Gambas:Video 20detik]"
"Demokrat: Kasihan Koalisi Lain, Nama Capresnya Belum Ada", 22 Feb 2023 16:55 ,https://news.detik.com/pemilu/d-6583226/demokrat-kasihan-koalisi-lain-nama-capresnya-belum-ada,"Wasekjen Partai Demokrat Jansen Sitindaon menilai 'Koalisi Perubahan' jauh lebih maju dibanding koalisi lain. Dia lantas merasa iba dengan koalisi di luar 'Koalisi Perubahan' yang belum mendeklarasikan nama capresnya.""Progres (deklarasi), pasti progresnya ke sana. Kan kasian juga koalisi yang lain, nama capresnya belum ada,"" ujar Jansen di kantor DPP Demokrat, Menteng, Jakarta Pusat, Rabu (22/2/2023).""Kalau kita ini kan sudah apa ya, jauh lebih maju lah dari koalisi lain. Jadi kalau deklarasi bersama pasti, tinggal kita cari waktunya,"" sambungnya.                Jansen mengatakan koalisinya meyakini apa yang dilakukan, termasuk soal mencapreskan Anies Baswedan. Hal itu, lanjut Jansen, tak seperti koalisi lainnya yang masih belum menentukan sosok capresnya.""Kalau kita maju terus, makanya kita kan sudah mencapreskan Mas Anies, kan, mungkin kalau embrio koalisi yang lain ya masih lihat-lihat, kan gitu. Kalau kita apa yg kita yakini itu yang kita lakukan,"" ungkap Jansen.Jansen menuturkan bahwa ada banyak hal yang perlu dibahas oleh 'koalisi perubahan' sebelum deklarasi, termasuk soal pertimbangan deklarasi cawapres. Dia kemudian mendorong tiga koalisi lainnya untuk juga segera mendeklarasikan capresnya.""Arahnya pasti ke sana (deklarasi). Kan tidak mungkin (tidak), kita sudah cukup 20 persen, tapi kan masih banyak detail yang mesti dibahas. Jadi, itu kan ada strateginya, kapan waktu tang pas nya, apakah bersamaan dengan cawapresnya,"" tutur Jansen.""Itu makanya dalam beberapa kesempatan saya katakan mbok ya tiga embrio koalisi yang lain itu, menyegerakan juga. Toh kan sudah cukup 20 persen itu? KIB dengan 3 partainya, kemudian KIR kan sudah cukup juga itu, teman2 PDIP. Ya minimal umumkan lah capresnya. Kalau wapresnya bisa saja ditahan di akhir-akhir, karena itu bagian dari strategi, mungkin biar ada efek kejutnya kan begitu kan. Karena kan cantik tuh,"" sambungnya."
"Pastikan Pemilih Meninggal, Petugas Pantarlih Luwu Cek Langsung ke Kuburan", 22 Feb 2023 16:55 ,https://www.detik.com/sulsel/berita/d-6583225/pastikan-pemilih-meninggal-petugas-pantarlih-luwu-cek-langsung-ke-kuburan,"Viral di media sosial petugas panitia pemutakhiran data pemilih (pantarlih) KPU Kabupaten Luwu, Sulawesi Selatan (Sulsel) melakukan pencocokan dan penelitian (coklit) data pemilih di kuburan jelang Pemilu 2024. Hal itu dilakukan untuk memastikan benar tidaknya salah seorang pemilih telah meninggal.Dalam video beredar, Rabu (22/2/2023), seorang petugas pantarlih mendatangi kuburan di Desa Pompengan, Kecamatan Lamasi Timur, Kabupaten Luwu. Petugas itu datang didampingi seorang pria dari pihak keluarga yang telah meninggal.Tiba-tiba, pria itu berbicara di depan batu nisan dan menjelaskan maksud kedatangan petugas pantarlih.                ""Maaf, pantarlih datang hendak bertanya karena mau mendata pemilih dan mau memastikan bahwa Anda sudah benar-benar mati, maaf sebelumnya,"" kata salah seorang keluarga sambil memegang papan nama kuburan.Pria itu pun kemudian, memperlihatkan nama almarhum yang telah meninggal untuk memperjelas kepada petugas pantarlih KPU Luwu.""Ini namanya Sahido kalau kuburan ini Abbas. Ok jelas yah,"" ucapnya.Sementara itu Ketua KPU Luwu, Ahsan Sofyan membenarkan video beredar tersebut. Menurutnya, hal itu dilakukan untuk mengecek data pemilih agar lebih akurat.""Iya betul saya liat di grup beredar, itu anggota kita di Desa Pompengan, Kecamatan Lamasi Timur. Sebenarnya metode pemeriksaan pemilih meninggal dunia itu dicek keterangan meninggal dari kelurahan atau rumah sakit, tapi mungkin pantarlih kita mau lebih akurat yah jadi dia cek langsung di kuburan,"" ungkapnya.Dia pun tidak mempermasalahkan kerja dari petugas pantarlih yang mengunjungi kuburan itu. Menurut dia, semangat pantarlih tersebut untuk menyukseskan Pemilu 2024 bisa menjadi contoh anggota pantarlih yang lain.""Justru saya apresiasi. Semangatnya untuk cek data pemilih agar lebih akurat harus menjadi contoh bagi pantarlih yang lain. Ya tapi kan sekarang ada data di kelurahan dan rumah sakit, jadi ada hal yang lebih mudah lagi,"" ucapnya.Ahsan menambahkan, pekerjaan pantarlih untuk mendata pemilih bukan pekerjaan yang mudah. Pasalnya kata dia, berbagai macam kendala yang dihadapi pantarlih di lapangan selama melakukan coklit, satu di antaranya, akses ke pelosok wilayah Luwu.""Bukan pekerjaan yang mudah, saya sering mendapat laporan kalau petugas pantarlih kita sering melalui medan berat saat ke pelosok. Saya sering bilang pekerjaan kalian ini gajinya tidak begitu banyak, tapi ini pekerjaan mulia dan akan dicatat dalam sejarah demokrasi Indonesia jadi berbanggalah kalian,"" tandasnya."
"Duet Anies-Sandi Mencuat di Survei Voxpol, PKS: Siapa Saja Berpeluang", 22 Feb 2023 16:13 ,https://news.detik.com/pemilu/d-6583068/duet-anies-sandi-mencuat-di-survei-voxpol-pks-siapa-saja-berpeluang,"Voxpol Center Research and Consulting menyebut duet Anies Baswedan dan Sandiaga Uno bisa dipertimbangkan untuk Pilpres 2024. PKS menyambut penilaian Voxpol tersebut.Founder sekaligus Direktur Eksekutif Voxpol, Pangi Syarwi Chaniago, mengulas hasil survei yang terakhir dirilis Voxpol dengan Anies Baswedan mendapat elektabilitas tertinggi di segmen capres dan Sandiaga tertinggi di sektor cawapres. Pangi kemudian mengulas kepemimpinan Anies dan Sandi di Jakarta. Anies dan Sandi tidak berpasangan sampai 5 tahun karena nama terakhir memutuskan maju Pilpres 2019.""Temuan terbaru survei Voxpol Center Research and Consulting yang dilakukan pada November 2022 menunjukkan potensi yang sangat besar bagi pasangan Anies-Sandi untuk dipasangkan sebagai calon presiden dan wakil presiden,"" kata Pangi dalam keterangannya, Rabu (22/2/2023).                Dalam survei yang dimaksud, elektabilitas Anies mencapai 23,6% dan Sandiaga 22,5%. Voxpol juga melakukan simulasi Pilpres 2024 tiga pasangan dengan duet Anies-Sandi mendapat 33,8%, Ganjar Pranowo-Erick Thohir 30,7% dan Prabowo-Khofifah 25,9%.""Data ini menunjukkan pasangan ini sangat potensial dan berpeluang besar mengulang sukses di Jakarta untuk dibawa ke arena yang lebih luas sebagai kandidat calon presiden dan wakil presidem. Itu artinya Anies-Sandi akan naik kelas bukan hanya untuk Jakarta tapi untuk Indonesia,"" ujar Pangi.Kata PKSJuru Bicara PKS Muhammad Iqbal menyambut baik hasil survei tersebut. Dia menganggap Sandiaga merupakan sosok yang dekat dengan PKS.""Saya kira Mas Sandi ini adalah orang yang sangat dekat dengan PKS, karena pernah diusung dan ini adalah pasangan yang pernah menang, artinya kami menyambut baik survei Mas Sandi yang tinggi,"" kata Iqbal dalam keterangan tertulis.""Dan memang saat ini kita belum menentukan cawapres. Artinya Sandi masih berpeluang untuk bisa diusung PKS dengan siapa saja berpeluang, termasuk Sandi, apalagi punya survei yang tinggi dan pernah menang bersama Anies,"" bebernya.Iqbal juga menyoroti rekam jejak Sandiaga di dunia usaha. Menurutnya, Sandiaga dapat menjadi representasi dari pemikiran kelompok milenial.""Kita kan sekarang menghadapi gejolak ekonomi dunia, kita memerlukan orang-orang yang kuat di dunia usaha, kuat di networking global, dan saya kira Mas Sandi ini profil yang bisa mengisi kekosongan-kekosongan enterpreneur, anak muda, juga bisa mewakili-representasi dari pemikiran milenial-milenial kita,"" katanya.Namun, Iqbal menekankan saat ini PKS tergabung dalam Koalisi Perubahan yang hendak dibentuk bersama Partai NasDem dan Partai Demokrat. Iqbal mengatakan partainya menyerahkan keputusan penetapan cawapres kepada partai-partai di koalisi dan Anies selaku capres usungan.""Saya kira dalam politik itu sangat dinamis, walaupun kita sudah memutuskan bahwa Pak Anies yang nanti juga akan memutuskan (cawapres) dan tentu ada persetujuan dari partai pengusung, saya kira bukan tidak mungkin Mas Sandi satu hari akan bersanding lagi dengan Pak Anies,"" ujarnya.Simak Video: Kata Paloh soal Potensi AHY Jadi Cawapres Anies: Lebih dari Pantas[Gambas:Video 20detik]"
"Relawan Jokowi Akan Gelar Musra Lagi di 11 Provinsi, Terakhir di Jakarta", 22 Feb 2023 15:58 ,https://news.detik.com/pemilu/d-6583041/relawan-jokowi-akan-gelar-musra-lagi-di-11-provinsi-terakhir-di-jakarta,"Gabungan Relawan Jokowi akan menggelar musyawarah rakyat (musra) di sejumlah provinsi hingga April nanti. Pada akhir pekan ini mereka akan menggelar musra di 3 provinsi.Pada Sabtu (25/2) nanti, relawan Jokowi akan menggelar musra di dua provinsi di Papua sekaligus. Terhitung sejak akhir pekan ini, Relawan Jokowi akan menggelar musra di 11 provinsi.""25 Februari 2023 kita akan selenggarakan musra di tanah Papua, bisa jadi langsung di dua provinsi di Papua itu, di tanggal yang sama, dan di waktu yang sama di Sorong dan Manokwari, Papua Barat Daya dan Papua Barat,"" kata Ketua Panitia Musra, Panel Barus, di FX Senayan, Jakarta Pusat, Rabu (22/2/2023).                Sehari kemudian, relawan Jokowi akan menggelar musra di Kalimatan Utara (Kaltara).""26 Februari 2023, satu hari berselang kita akan selenggarakan musra ke XX di Kaltara di Tarakan, setelah 26 Februari, kita akan selenggarakan musra 4 Maret di Pontianak Kalbar,"" ujarnya.Selanjutnya, pada Minggu (5/3), relawan Jokowi akan kembali menggelar musra di Sulawesi Tengah. Kemudian, musra juga akan digelar di Nusa Tenggara Barat, Aceh, Jambi dan akan ditutup di Jakarta.""5 Maret satu hari berselang kita akan laksanakan musra di Sulawesi Tengah, Palu. Lalu berikutnya ada 11-12 (Maret) seterusnya, 11 di Sumut, 12 di NTB, baru lompat ke tanggal 18-19 (Maret) ya, ada Aceh, ada Jambi, ada Bengkulu,"" kata dia.""Terakhir kita akan tutup musra di Jakarta, kemungkinan besar akan kita laksanakan setelah lebaran Idul Fitri, di Kemayoran,"" imbuh Panel."
"Besok, PKS Deklarasi Resmi Anies Baswedan Capres 2024!", 22 Feb 2023 15:55 ,https://news.detik.com/pemilu/d-6583032/besok-pks-deklarasi-resmi-anies-baswedan-capres-2024,"PKS akan mendeklarasikan secara resmi eks Gubernur DKI Anies Baswedan sebagai capres untuk Pilpres 2024. Deklarasi ini dilakukan menjelang acara rapat kerja nasional (rakernas) PKS.""Iya betul. Besok DPP PKS secara resmi mendeklarasikan Anies Baswedan jam 13.00 di kantor DPP PKS di TB Simatupang,"" kata Juru Bicara (Jubir) PKS M Iqbal kepada wartawan, Rabu (22/2/2023).Iqbal mengatakan acara itu diawali musyawarah oleh jajaran Majelis Syuro PKS dan ditutup dengan agenda deklarasi Anies Baswedan sebagai capres yang didukung di 2024.                ""Musyawarah majelis syuro, ditutup dengan deklarasi resmi,"" kata Iqbal.Iqbal mengatakan deklarasi dukungan ke Anies itu akan disampaikan langsung oleh Presiden PKS Ahmad Syaikhu. Anies juga akan hadir secara langsung dalam acara deklarasi.""Disampaikan langsung oleh Presiden PKS dan dihadiri Anies,"" katanya.Tonton juga Video: AHY Sepakat Anies Jadi Capres Pembawa Gerakan Perubahan dan Perbaikan[Gambas:Video 20detik]"
"Paloh Cerita Kunjungi PKS Sebelum Berkoalisi, Ungkit Rangkulan Persahabatan", 22 Feb 2023 15:53 ,https://news.detik.com/pemilu/d-6583026/paloh-cerita-kunjungi-pks-sebelum-berkoalisi-ungkit-rangkulan-persahabatan,"Ketum Partai NasDem Surya Paloh mengatakan NasDem akan berkunjung juga ke markas Partai Keadilan Sejahtera (PKS). Dia menyebut akan mencari waktu yang cocok untuk pertemuan itu.""PKS, kita cari waktu yang cocok nanti (untuk) kawan-kawan PKS,"" ujar Paloh saat ditanyai terkait rencana kunjungan ke markas PKS, di DPP Partai Demokrat, Jakarta Pusat, Rabu (22/2/2023).Paloh menyebut dirinya sudah datang ke markas PKS jauh sebelum 'koalisi perubahan' lahir. Dia menyebut itu sebagai rangkulan persahabatan.                ""Jangankan sekarang kita berkoalisi, jauh-jauh hari sebelum koalisi sudah pergi saya ke PKS,"" ungkap Paloh.""Yang terkenal dengan rangkulan persahabatan,"" sambungnya.Untuk diketahui, Ketum Partai NasDem Surya Paloh tiba di kantor DPP Partai Demokrat untuk bertemu dengan Ketum. Partai Demokrat Agus Harimurti Yudhoyono (AHY). Pertemuan ini disebut untuk mematangkan Koalisi Perubahan.Surya Paloh mengungkapkan isi pertemuannya dengan Ketua Umum Partai Demokrat Agus Harimurti Yudhoyono (AHY). Surya Paloh menyebut tak ada perbedaan di dalam Koalisi Perubahan.Awalnya Surya Paloh bicara soal ada kesepakatan-kesepakatan dalam pertemuan itu seperti yang telah disampaikan oleh AHY. Surya Paloh menyebut diskusi dengan Demokrat cukup intens.""Tidak ada perbedaan apapun dari satu diskusi yang cukup intens tadi, mempunyai kesepakatan, kesepahaman pandangan yang sama. Semua disatukan oleh niat baik dari kedua institusi partai politik ini untuk ingin memberikan kontribusi yang optimal bagi kepentingan kemajuan bangsa dan negara,"" kata Surya Paloh saat konferensi pers bersama AHY di DPP Demokrat, Jakarta, Rabu (22/2).Menurut Surya Paloh, jika ada perbedaan pandangan, hal itu adalah hal yang biasa.""Tentu dalam sebuah sistem negara demokrasi, tidak semua bermufakat. Dalam kesepakatan ini, ada perbedaan, ada beda pandangan, beda pikiran yang melahirkan satu dan lain, kita bersepakat tapi mempunyai optimisme dan keyakinan penuh didasari oleh hal baik,"" katanya.Surya Paloh menegaskan bahwa tidak ada perbedaan di antara mitra calon Koalisi Perubahan yang mengusung Anies Baswedan sebagai bakal calon presiden.""Hal yang perlu kami utarakan pada saudara semuanya. Mengenai masalah koalisi di antara Demokrat, PKS, NasDem, sudah menjelaskan tadi. Saya pikir tidak ada perbedaan sedikitpun,"" katanya."
"Elektabilitas NasDem Melesat Naik, Surya Paloh: Kami Terbiasa Rendah", 22 Feb 2023 15:38 ,https://news.detik.com/pemilu/d-6582984/elektabilitas-nasdem-melesat-naik-surya-paloh-kami-terbiasa-rendah,"Ketum Partai NasDem Surya Paloh buka suara soal elektoral partainya yang melesat naik dibanding PKS dan Demokrat yang mengalami penurunan di survei Litbang Kompas. Paloh mengatakan partai-partai di Koalisi Perubahan berkewajiban untuk saling membesarkan hati.Mulanya, Paloh mengatakan lembaga survei memberikan indikasi kepada partai politik (parpol). Dia lalu mengatakan NasDem sudah terbiasa dengan hasil survei yang rendah.""Kita kan bisa memahami lembaga survei memberikan indikasi, indikator tentu pemahaman kami, baik saya, Demokrat Mas AHY, dan partai lainnya, semua menghargai pikiran hasil survei. NasDem sudah terbiasa surveinya rendah, naik sedikit baru napas aja, turun lagi,"" kata Paloh di kantor DPP Demokrat, Jakarta Pusat, Rabu (22/2/2023).                ""Tapi kami saling besarkan hati, itu kewajiban. Kalau mas AHY kecil, PKS dikit, itu kewajiban saya,"" lanjutnya.Paloh mengatakan hasil survei ialah hal yang dinamis dalam sebuah progres. Dia menyebut ketiga partai, yakni PKS, NasDem, dan Demokrat, berkewajiban untuk saling berusaha hadir di perjalanan politik yang panjang.""Semuanya ini adalah hal yang dinamis dalam suatu progres. Jadi itu bukan semuanya hari ini, sebagai indikasi hari ini, ya, tapi kan ini panjang perjalanan, tapi kami berkewajiban untuk saling berusaha hadir, itu kewajiban,"" ujar Paloh.Paloh menilai unsur 'saling hadir' inilah yang menjadi nilai jual 'koalisi perubahan. Dia menyebut koalisinya tidak sekadar lip service karena kebutuhan sesaat saja.""Jadi kalau Mas AHY barangkali ada sedikit murung kecil, itu kewajiban saya bikin dia gembira sedikit. Kawan-kawan PKS sedikit, nah itu, kalau nggak, kalau koalisinya nggak hangat, koalisinya hanya sekadar lip service saja, karena kebutuhan sesaat bersama-sama, habis itu kita tidak saling mengenal satu sama lain, ya mudah-mudahan jangan terjadi diantara Demokrat, PKS, dan NasDem,"" beber Paloh.""Ini yang namanya Perubahan. Jadi kepada teman-teman semuanya, semuanya kami memiliki spirit yang sama, saling membesarkan hati, dan insyaAllah progres yang jauh lebih positif bisa kami dapatkan di depan, kami semua berkepentingan dan semoga termanage dengan baik,"" sambungnya.Untuk diketahui, dalam lingkaran partai 'koalisi perubahan' elektoral NasDem melesat naik dibanding PKS dan Demokrat yang mengalami penurunan di survei Litbang Kompas. PKS dan Demokrat memahami kenaikan elektoral NasDem karena efek ekor jas Anies Baswedan, meski begitu keduanya tidak merasa iri.Survei periodik Litbang Kompas ini dilakukan melalui wawancara tatap muka pada 25 Januari-4 Februari 2023. Total 1.202 responden dipilih secara acak menggunakan metode pencuplikan sistematis bertingkat di 38 provinsi di Indonesia.Tingkat kepercayaan survei menggunakan metode ini mencapai 95 persen dengan margin of error +- 2,83 persen dalam kondisi penarikan sampel acak sederhana. Litbang Kompas menyatakan kesalahan di luar pemilihan sampel dimungkinkan terjadi.Dalam survei ini, elektoral NasDem berada di urutan kelima dengan suara 7,3%. Sementara PKS 4,8% dan Demokrat 8,7%. Secara tren NasDem mengalami kenaikan, PKS dan Demokrat merosot.Berikut berbandingan elektoral ketiga partai itu di survei saat ini dan periode sebelumnya:Periode Januari-Februari 2023Demokrat 8,7%NasDem 7,3%PKS 4,8%Periode September-Oktober 2022Demokrat 14%NasDem 4,3%PKS 6,3%Berikut ini elektabilitas partai politik hasil Survei Litbang Kompas, dikutip Selasa (21/2/2023):1. PDIP 22,9%2. Gerindra 14,3% 3. Golkar 9% 4. Demokrat 8,7%5. NasDem 7,3%6. PKB 6,1%7. PKS 4,8% 8. Perindo 4,1%9. PPP 2,3%10. PAN 1,6% 11. Hanura 0,5%12. PBB 0,5%13. PSI 0,5%14. Lainnya 0,5% 15. Tidak tahu/rahasia 16,8%"
Cak Imin Beber Alasan Koalisi Gerindra-PKB Belum Umumkan Capres-Cawapres, 22 Feb 2023 15:34 ,https://www.detik.com/jatim/berita/d-6582974/cak-imin-beber-alasan-koalisi-gerindra-pkb-belum-umumkan-capres-cawapres,"Koalisi Gerindra-PKB sudah mendeklarasikan diri sejak Agustus 2022 lalu. Namun, hingga saat ini belum ada nama capres atau cawapres dari Koalisi Kebangkitan Indonesia Raya (KKIR) tersebut.Ketum PKB Muhaimin Iskandar mengungkapkan, koalisi Gerindra-PKB masih menunggu partai lain untuk mengumumkan nama capres-cawapres untuk Pilpres 2024.""Capres-cawapres masih proses diskusi, melihat peta. (PKB-Gerindra) Melihat perkembangan partai-partai lain, baru kami ambil keputusan,"" kata Muhaimin usai acara Menjemput Pesan Kampus di Universitas Trunojoyo, Madura, Rabu (22/2/2023).                Politikus yang akrab disapa Cak Imin ini menyatakan bahwa semua partai masih stuck, menunggu keputusan masing-masing koalisi.Menurutnya, saat ini semua partai memang masih sama-sama menunggu momentum yang tepat sambil mengintip siapa yang akan diusung di koalisi lainnya.""Ya lihat kebutuhan untuk peta dari capres-cawapres partai lain juga,"" jelasnya.Ditanya apakah PKB-Gerindra menunggu PDIP mengumumkan capres-cawapresnya, Cak Imin menjawab secara diplomatis.""Ya, menunggu semuanya lah (semua koalisi mengumumkan gaconya),"" tambahnya.Cak Imin menegaskan PKB masih solid dengan Gerindra. Setiap pembahasan koalisi atau capres-cawapres akan dirundingkan bersama dengan Gerindra.""Saya sudah terikat dengan Gerindra, sehingga semua langkah-langkah PKB, langkah-langkah Gerindra ke depan menjadi kewajiban untuk membicarakan bersama-sama,"" tandasnya."
